<?xml version="1.0" encoding="UTF-8"?>
<p:nalog idPoruke="" xmlns:p="http://www.toomanysecrets.com/tipovi" xmlns:xsi="http://www.w3.org/2001/XMLSchema-instance" xsi:schemaLocation="http://www.toomanysecrets.com/tipovi ../WEB-INF/shema/NalogRaw.xsd ">
  <p:duznikNalogodavac>BokiÄ‡ DOO</p:duznikNalogodavac>
  <p:svrhaPlacanja>Borko naredio</p:svrhaPlacanja>
  <p:primalacPoverilac>Borko Vukosav</p:primalacPoverilac>
  <p:datumNaloga>2014-01-01</p:datumNaloga>
  <p:datumValute>2014-01-01</p:datumValute>
  <p:racunDuznika>110123456789123455</p:racunDuznika>
  <p:modelZaduzenja>0</p:modelZaduzenja>
  <p:pozivNaBrojZaduzenja>1</p:pozivNaBrojZaduzenja>
  <p:racunPoverioca>220123456789123455</p:racunPoverioca>
  <p:modelOdobrenja>0</p:modelOdobrenja>
  <p:pozivNaBrojOdobrenja>1</p:pozivNaBrojOdobrenja>
  <p:iznos>1000.0</p:iznos>
  <p:oznakaValute>EUR</p:oznakaValute>
  <p:hitno>false</p:hitno>
</p:nalog>
